{"categoricalVocabulary":{"groundingStatus":["file_missing","grounded","line_drift","native_or_unspecified","not_applicable"],"identityMatchTier":["dedup_collision","dedup_key_cross_run","model_dedupe","stable_fp","unknown"],"pathBucket":["application","config","docs","example","generated","test","unknown","vendor"],"ruleFamily":["authentication","authorization","availability","command_injection","concurrency","crypto","csrf","deserialization","injection","memory_safety","other","path_traversal","secrets","sql_injection","ssrf","xss"],"staticProofState":["code_cited","missing","needs_runtime_evidence","sanitizer_checked","signal_only","source_sink_linked","statically_confirmed","statically_rejected"],"toolFamily":["carlini-threat-hunt","chains","codeql","dep-hygiene","full-mode-multi","govulncheck","iac-scan","infer","other","secret-scan","semgrep","systems-hunt","variant-ndiff"],"vulnSource":["analysis","analysis-multi","diff-analyzer","fuzzing","infer","sarif","unknown"]},"census":{"adjudicatedIdentities":320,"byAuthor":{"human":320},"byDismissReason":{},"byVerdict":{"confirmed":71,"rejected_false_positive":175,"to_fix":74},"conflicted":0,"cutoffQuality":{"barrier_at_head":160,"tui_read_watermark":160},"decisionEvents":320,"distinctLanguageFamilies":7,"distinctRepositories":6,"distinctRuleFamilies":16,"distinctToolFamilies":13,"earliestLabelEventSeq":1000,"eligibleIdentities":320,"eventLogHeadSeq":1958,"featureSchemaId":"kuzushi-review-yield-features-v1","humanDecisionEvents":320,"labelPolicyId":"kuzushi-review-yield-labels-v1","latestLabelEventSeq":1957,"missingDurableIdentity":0,"missingExactCutoff":0,"missingPreCutoffObservation":0,"negative":175,"noEligibleLabel":0,"policyTransitions":0,"positive":145,"projectionAppliedSeq":1958,"projectionGeneration":1,"taskId":"review_yield_predecision_v1"},"datasetDigest":"blake3:dc4a56c058560ef65fe5ce18e5c03a36137d41616618b626ce45c65850dff7d3","exporterVersion":"0.0.0-synthetic","featureFields":["severityRank","staticProofState","vulnSource","toolFamily","ruleFamily","pathBucket","languageFamily","identityMatchTier","groundingStatus","isAttackChain","evidenceCount","distinctEvidenceKinds","maxEvidenceConfidence","meanEvidenceConfidenceMillis","hasSourceEvidence","hasSinkEvidence","hasSanitizerEvidence","hasCallPathEvidence","sourceSinkLinked","sanitizerChecked","hasExploitScenario","preconditionCount","sourceCount","distinctToolCount","corroborationCount","observationCount","runCount","reopenedCount","hasRemediation"],"featureSchemaId":"kuzushi-review-yield-features-v1","labelPolicy":{"conflictRule":"identities with conflicting human verdicts are excluded","cutoffRule":"features are read at the decision's read cutoff, never after","excluded":["accepted_risk","suppressed","deferred","needs_review"],"excludedAuthors":["auto","imported","other"],"exportedCutoffQuality":["tui_read_watermark","barrier_at_head"],"id":"kuzushi-review-yield-labels-v1","identityRule":"one example per durable finding identity","includedAuthors":["human"],"negative":["rejected_false_positive"],"positive":["confirmed","to_fix"]},"labelPolicyId":"kuzushi-review-yield-labels-v1","rowCount":320,"ruleFamilyPattern":"^(cwe-[0-9]+|[a-z_]+)$","schemaVersion":1,"source":{"eventLogHeadSeq":1958,"projectionAppliedSeq":1958,"projectionGeneration":1},"taskId":"review_yield_predecision_v1"}